sys_id,number,short_description,description,state,priority,urgency,category,subcategory,opened_at
001,INC0010001,VPN connection issue,Cannot connect to VPN from home,2,2,2,network,vpn,2024-01-15T09:00:00Z
002,INC0010002,Password reset request,Need to reset my domain password,1,3,3,inquiry,password,2024-01-15T10:30:00Z
003,INC0010003,Laptop not booting,My laptop shows black screen on startup,2,1,1,hardware,laptop,2024-01-15T11:45:00Z
004,INC0010004,Software installation,Need Adobe Acrobat Pro installed,1,3,3,software,installation,2024-01-16T08:15:00Z
005,INC0010005,Email not syncing,Outlook not receiving new emails,2,2,2,email,sync,2024-01-16T13:20:00Z
